{
  "$schema": "https://json-schema.org/draft/2020-12/schema",
  "$id": "https://github.com/orq-ai/assistant-plugins/skills/orq-recommend-evaluators/resources/evaluations.schema.json",
  "title": "Evaluation recommendations",
  "description": "The evaluators recommended for one agent or deployment, most important first. Written by orq-recommend-evaluators as eval-recommendations-<key>-<timestamp>.json.",
  "type": "object",
  "additionalProperties": false,
  "required": ["schema_version", "target", "grounding", "evaluations"],
  "properties": {
    "schema_version": { "const": 1 },
    "target": {
      "type": "object",
      "additionalProperties": false,
      "required": ["type", "key", "id"],
      "properties": {
        "type": { "enum": ["agent", "deployment"] },
        "key": { "type": "string", "minLength": 1 },
        "id": { "type": ["string", "null"], "minLength": 1 }
      }
    },
    "grounding": {
      "description": "What the recommendations rest on, so an empty list still says what backs it.",
      "type": "object",
      "additionalProperties": false,
      "required": ["mode", "reason"],
      "properties": {
        "mode": { "enum": ["config-only", "traces", "error-analysis"] },
        "reason": {
          "description": "For traces: the total count, how many were read and how many of those had readable text. For error-analysis: the file used. For config-only: the trace count that ruled out traces.",
          "type": "string",
          "minLength": 1
        }
      }
    },
    "evaluations": {
      "description": "In rank order, most important first. Empty when nothing is worth adding. The producing skill caps its own list; the data model does not.",
      "type": "array",
      "items": { "$ref": "#/$defs/evaluation" }
    }
  },
  "$defs": {
    "evaluation": {
      "type": "object",
      "additionalProperties": false,
      "required": ["name", "description", "type", "existing_evaluator_id", "execute_on", "priority", "reason", "caveats"],
      "properties": {
        "name": {
          "description": "Evaluator key for a new evaluator (kebab-case is the convention), or the existing key for a reused one, which may be spaced Title Case such as \"BLEU Score\". Any orq evaluator key is accepted.",
          "type": "string",
          "pattern": "^[A-Za-z0-9]([A-Za-z0-9 ._-]*[A-Za-z0-9])?$"
        },
        "description": {
          "description": "What the evaluator checks, in one sentence.",
          "type": "string",
          "minLength": 1
        },
        "type": {
          "description": "The orq evaluator type. For a reused evaluator, its existing type.",
          "enum": ["llm_eval", "python_eval", "function_eval", "json_schema", "http_eval", "ragas"]
        },
        "existing_evaluator_id": {
          "description": "The id of an existing evaluator to attach as is, or null when a new one is needed.",
          "type": ["string", "null"],
          "minLength": 1
        },
        "execute_on": { "enum": ["input", "output"] },
        "priority": { "enum": ["high", "medium", "low"] },
        "reason": {
          "description": "Why it is worth attaching: the consequence of the rule breaking, and the evidence.",
          "type": "string",
          "minLength": 1
        },
        "caveats": {
          "description": "What could make this recommendation wrong, such as an incomplete evaluator inventory. Empty when there are none.",
          "type": "array",
          "items": { "type": "string", "minLength": 1 }
        }
      },
      "if": { "properties": { "existing_evaluator_id": { "type": "null" } } },
      "then": {
        "properties": {
          "type": { "enum": ["llm_eval", "python_eval"] },
          "name": {
            "description": "A new evaluator's name becomes its orq key, so it must match the key rule the API enforces. A reused evaluator's name echoes an existing key, which may hold spaces.",
            "pattern": "^[a-zA-Z0-9]([a-zA-Z0-9_-]*[a-zA-Z0-9])?$"
          }
        }
      }
    }
  }
}
