{
  "schema_version": 1,
  "target": {
    "type": "agent",
    "key": "ws-refund-agent",
    "id": "agent_0001"
  },
  "grounding": { "mode": "traces", "reason": "343 traces in the last 14 days; 20 read, 12 with readable text" },
  "evaluations": [
    {
      "name": "check-0",
      "description": "Every refund comes after an order lookup for the same order.",
      "type": "llm_eval",
      "existing_evaluator_id": null,
      "execute_on": "output",
      "priority": "high",
      "reason": "A refund issued for an unverified order costs money; 11 of 11 recent refunds had no lookup.",
      "caveats": []
    },
    {
      "name": "check-1",
      "description": "Every refund comes after an order lookup for the same order.",
      "type": "llm_eval",
      "existing_evaluator_id": null,
      "execute_on": "output",
      "priority": "high",
      "reason": "A refund issued for an unverified order costs money; 11 of 11 recent refunds had no lookup.",
      "caveats": []
    },
    {
      "name": "check-2",
      "description": "Every refund comes after an order lookup for the same order.",
      "type": "llm_eval",
      "existing_evaluator_id": null,
      "execute_on": "output",
      "priority": "high",
      "reason": "A refund issued for an unverified order costs money; 11 of 11 recent refunds had no lookup.",
      "caveats": []
    },
    {
      "name": "check-3",
      "description": "Every refund comes after an order lookup for the same order.",
      "type": "llm_eval",
      "existing_evaluator_id": null,
      "execute_on": "output",
      "priority": "high",
      "reason": "A refund issued for an unverified order costs money; 11 of 11 recent refunds had no lookup.",
      "caveats": []
    },
    {
      "name": "check-4",
      "description": "Every refund comes after an order lookup for the same order.",
      "type": "llm_eval",
      "existing_evaluator_id": null,
      "execute_on": "output",
      "priority": "high",
      "reason": "A refund issued for an unverified order costs money; 11 of 11 recent refunds had no lookup.",
      "caveats": []
    },
    {
      "name": "check-5",
      "description": "Every refund comes after an order lookup for the same order.",
      "type": "llm_eval",
      "existing_evaluator_id": null,
      "execute_on": "output",
      "priority": "high",
      "reason": "A refund issued for an unverified order costs money; 11 of 11 recent refunds had no lookup.",
      "caveats": []
    }
  ]
}
